{
  "$id": "https://github.com/netrunnerdb/netrunner-cards-json/blob/master/schema/v2/printings_schema.json",
  "$schema": "https://json-schema.org/draft/2020-12/schema",
  "items": {
    "additionalProperties": false,
    "dependentSchemas": {
      "layout_id": {
        "oneOf": [
          {
            "properties": {
              "faces": {
                "type": "null"
              },
              "layout_id": {
                "oneOf": [
                  {
                    "const": "normal"
                  },
                  {
                    "type": "null"
                  }
                ]
              }
            }
          },
          {
            "properties": {
              "faces": {
                "items": {
                  "type": "object"
                },
                "maxItems": 1,
                "minItems": 1,
                "type": "array"
              },
              "layout_id": {
                "const": "flip"
              }
            },
            "required": ["faces"]
          },
          {
            "properties": {
              "faces": {
                "items": {
                  "type": "object"
                },
                "minItems": 1,
                "type": "array"
              },
              "layout_id": {
                "const": "copy"
              }
            },
            "required": ["faces"]
          },
          {
            "properties": {
              "faces": {
                "items": {
                  "type": "object"
                },
                "minItems": 1,
                "type": "array"
              },
              "layout_id": {
                "const": "facade"
              }
            },
            "required": ["faces"]
          }
        ]
      }
    },
    "properties": {
      "card_id": {
        "minLength": 1,
        "type": "string"
      },
      "card_set_id": {
        "minLength": 1,
        "type": "string"
      },
      "copy_quantity": {
        "minimum": 1,
        "type": "integer"
      },
      "faces": {
        "oneOf": [
          {
            "type": "array"
          },
          {
            "type": "null"
          }
        ]
      },
      "flavor": {
        "minLength": 1,
        "type": "string"
      },
      "id": {
        "minLength": 1,
        "type": "string"
      },
      "illustrator": {
        "minLength": 1,
        "type": "string"
      },
      "layout_id": {
        "oneOf": [
          {
            "enum": ["normal", "flip", "copy", "facade", "progression"],
            "type": "string"
          },
          {
            "type": "null"
          }
        ]
      },
      "position": {
        "minimum": 1,
        "type": "integer"
      },
      "quantity": {
        "minimum": 1,
        "type": "integer"
      },
      "released_by": {
        "enum": ["fantasy_flight_games", "null_signal_games"],
        "minLength": 1,
        "type": "string"
      }
    },
    "required": [
      "card_id",
      "card_set_id",
      "id",
      "position",
      "quantity",
      "released_by"
    ],
    "type": "object"
  },
  "type": "array"
}
